CHAMADO,STATUS,PRODUTO,DESCRICAO_PRODUTO,PROCESSO,DESCRICAO_PROCESSO,PROBLEMA,DESCRICAO_PROBLEMA,LOCALIDADE_SOLICITACAO,TIPO_DE_CHAMADO,ANALISE_DE_SENTIMENTO,DESCRIÇÃO
PSQ2024000071561,PesqSat_AgClassOuvUnid,Psa,Emergência Adulta,Atendimento Médico - Clínica Médica,vazio,Postura,vazio,PE - Hospital Esperança Recife,Elogio,Elogio,"Dra. Ana Laura, EXCELENTE PROFISSIONAL"
PSQ2024000071566,PesqSat_AgClassOuvUnid,Psa,Emergência Adulta,Tomografia,vazio,Demora para Atendimento,vazio,RJ - Hospital CopaStar,Reclamação,Reclamação,"o exame de imagem - TC Abdome Total - deveria estar liberado para eu pegar em 48hs, segundo me foi dito. Não está."
PSQ2024000071569,PesqSat_AgClassOuvUnid,Psa,Emergência Adulta,Atendimento Médico - Clínica Médica,vazio,Postura,vazio,PE - Hospital Esperança Recife,Elogio,Elogio,O médico é um profissional incrível e atencioso.
PSQ2024000071586,PesqSat_AgClassOuvUnid,Psa,Emergência Adulta,Avaliação Geral,vazio,Elogio Geral,vazio,RJ - Hospital CopaStar,Elogio,Elogio,O atendimento do começo ao fim foi excelente
PSQ2024000071559,PesqSat_AgClassOuvUnid,Psi,Emergência Infantil,Atendimento Médico - Clínica Médica,vazio,Conduta,vazio,RJ - Hospital Norte D'Or,Reclamação,Reclamação,"Minha filha deu entrada no dia 28 com febre e logo foi diagnosticada com dengue. O primeiro atendimento foi ótimo, mas devido a baixa de plaquetas tive nso que voltar outras vezes e passamos por alguns médicos sem experiência  alguma falando de internação sem a mínima necessidade. Jovens médicos  perdidos  com o protocolo do hospital. Sem contar  na equipe de enfermagem  que quase nunca acertava a veia para o acesso e fizeram vários furos e ou mexendo coma  agulha dentro do bracoboractebtar acertar o que ocasionou  hematomas no braço da minha filha. Em um dos retornos passamos tb pela pediatra Cristiane que foi a única que nos acalmou relacionado  ao quadro. Tô totalmente  decepcionado  com o atendimento. Não recomendo"
PSQ2024000071559,PesqSat_AgClassOuvUnid,Psi,Emergência Infantil,Enfermagem,vazio,Acesso Venoso,vazio,RJ - Hospital Norte D'Or,Reclamação,Reclamação,"Minha filha deu entrada no dia 28 com febre e logo foi diagnosticada com dengue. O primeiro atendimento foi ótimo, mas devido a baixa de plaquetas tive nso que voltar outras vezes e passamos por alguns médicos sem experiência  alguma falando de internação sem a mínima necessidade. Jovens médicos  perdidos  com o protocolo do hospital. Sem contar  na equipe de enfermagem  que quase nunca acertava a veia para o acesso e fizeram vários furos e ou mexendo coma  agulha dentro do bracoboractebtar acertar o que ocasionou  hematomas no braço da minha filha. Em um dos retornos passamos tb pela pediatra Cristiane que foi a única que nos acalmou relacionado  ao quadro. Tô totalmente  decepcionado  com o atendimento. Não recomendo"
PSQ2024000071559,PesqSat_AgClassOuvUnid,Psi,Emergência Infantil,Avaliação Geral,vazio,Crítica Geral,vazio,RJ - Hospital Norte D'Or,Reclamação,Reclamação,"Minha filha deu entrada no dia 28 com febre e logo foi diagnosticada com dengue. O primeiro atendimento foi ótimo, mas devido a baixa de plaquetas tive nso que voltar outras vezes e passamos por alguns médicos sem experiência  alguma falando de internação sem a mínima necessidade. Jovens médicos  perdidos  com o protocolo do hospital. Sem contar  na equipe de enfermagem  que quase nunca acertava a veia para o acesso e fizeram vários furos e ou mexendo coma  agulha dentro do bracoboractebtar acertar o que ocasionou  hematomas no braço da minha filha. Em um dos retornos passamos tb pela pediatra Cristiane que foi a única que nos acalmou relacionado  ao quadro. Tô totalmente  decepcionado  com o atendimento. Não recomendo"
